<?xml version="1.0" encoding="UTF-8"?>
<iati-activities version="2.03">
 <iati-activity default-currency="USD" hierarchy="2" humanitarian="0" iati-activities:version="2.03" xml:lang="EN" xmlns:iati-activities="http://d-portal.org/xmlns/iati-activities">
  <iati-identifier>US-EIN-13-2890727-001</iati-identifier>
  <reporting-org ref="US-EIN-13-2890727" type="80">
   <narrative xml:lang="EN">Guttmacher Institute</narrative>
  </reporting-org>
  <title>
   <narrative xml:lang="EN">International Research, Advocacy and Communications</narrative>
  </title>
  <description type="1">
   <narrative xml:lang="EN">This body of work includes Guttmacher&apos;s international research, advocacy and communications activities at the country, regional and global levels.</narrative>
  </description>
  <participating-org activity-id="NG-CAC-692943-AHEAD/CRERD_MISO_STUDY" ref="NG-CAC-692943" role="4" type="80">
   <narrative xml:lang="EN">Academy for Health Development (AHEAD)</narrative>
  </participating-org>
  <participating-org activity-id="US-EIN-06-1608361-US-EIN-06-1608361" ref="US-EIN-06-1608361" role="4" type="21">
   <narrative xml:lang="EN">African Population and Health Research Center</narrative>
  </participating-org>
  <participating-org activity-id="NP-SWC-1844-http://crehpa.org.np/" ref="NP-SWC-1844" role="4" type="22">
   <narrative xml:lang="EN">Center for Research on Environment Health and Population Activities (CREHPA)</narrative>
  </participating-org>
  <participating-org activity-id="NG-CAC-11660-QUALITY OF CARE OF MISOPROSTOL PROVISION IN NIGERIA" ref="NG-CAC-11660" role="4" type="22">
   <narrative xml:lang="EN">Center for Research, Evaluation Resources and Development (CRERD)</narrative>
  </participating-org>
  <participating-org activity-id="CO-RUE-860049972-MisoprostolstudyinColombia" ref="CO-RUE-860049972" role="4" type="22">
   <narrative xml:lang="EN">Fundacion Orientame</narrative>
  </participating-org>
  <participating-org activity-id="US-EIN-132890727-001" ref="US-EIN-132890727" role="2" type="21">
   <narrative xml:lang="EN">Guttmacher Institute</narrative>
  </participating-org>
  <participating-org activity-id="US-EIN-132890727-001" ref="US-EIN-132890727" role="4" type="21">
   <narrative xml:lang="EN">Guttmacher Institute</narrative>
  </participating-org>
  <participating-org activity-id="US-EIN-52-0595110-128174" ref="US-EIN-52-0595110" role="4" type="80">
   <narrative xml:lang="EN">Johns Hopkins University</narrative>
  </participating-org>
  <participating-org activity-id="XI-GRID-grid.9829.a-KNUST-SPH/PMA-GI/1" ref="XI-GRID-grid.9829.a" role="4" type="80">
   <narrative xml:lang="EN">Kwame Nkrumah University of Science and Technology</narrative>
  </participating-org>
  <participating-org activity-id="XM-DAC-7-PPR-4000000282" ref="XM-DAC-7" role="1" type="10">
   <narrative xml:lang="EN">Netherlands - Ministry of Foreign Affairs</narrative>
  </participating-org>
  <participating-org activity-id="US-EIN-13-1687001-US-EIN-13-2890727-001" ref="US-EIN-13-1687001" role="4" type="80">
   <narrative xml:lang="EN">Population Council, Inc., The</narrative>
  </participating-org>
  <participating-org activity-id="GB-1-203177-101" ref="GB-GOV-1" role="1" type="10">
   <narrative xml:lang="EN">UK - Department for International Development (DFID)</narrative>
  </participating-org>
  <participating-org activity-id="XI-GRID-grid.13001.33-AbortionincidencestudyinZimbabwe" ref="XI-GRID-grid.13001.33" role="4" type="80">
   <narrative xml:lang="EN">University Of Zimbabwe</narrative>
  </participating-org>
  <participating-org activity-id="ZW-ROD-MA988-87-US-EIN-132890727-00" ref="ZW-ROD-MA988-87" role="4" type="22">
   <narrative xml:lang="EN">Women&apos;s Action Group</narrative>
  </participating-org>
  <other-identifier ref="US-EIN-132890727" type="B9"></other-identifier>
  <other-identifier ref="US-EIN-132890727-001" type="A9"></other-identifier>
  <activity-status code="2"></activity-status>
  <activity-date iso-date="2016-04-01" type="2"></activity-date>
  <activity-date iso-date="2021-12-31" type="3"></activity-date>
  <contact-info type="1">
   <organisation>
    <narrative xml:lang="EN">Guttmacher Institute</narrative>
   </organisation>
   <telephone>212-248-1111 x2208</telephone>
   <email>iati@guttmacher.org</email>
   <website>http://www.guttmacher.org</website>
   <mailing-address>
    <narrative xml:lang="EN">125 Maiden Lane, Floor 7 New York, NY 10038 USA</narrative>
   </mailing-address>
  </contact-info>
  <recipient-region code="998" percentage="100" vocabulary="1"></recipient-region>
  <sector code="13010" percentage="100" vocabulary="1"></sector>
  <policy-marker code="9" significance="4" vocabulary="1"></policy-marker>
  <default-flow-type code="30"></default-flow-type>
  <default-finance-type code="110"></default-finance-type>
  <default-aid-type code="C01" vocabulary="1"></default-aid-type>
  <default-tied-status code="5"></default-tied-status>
  <budget status="1" type="2">
   <period-start iso-date="2017-01-01"></period-start>
   <period-end iso-date="2017-12-31"></period-end>
   <value currency="USD" value-date="2017-12-31">4773696</value>
  </budget>
  <transaction ref="DFID Commitment">
   <transaction-type code="11"></transaction-type>
   <transaction-date iso-date="2016-04-01"></transaction-date>
   <value currency="GBP" value-date="2016-04-01">8724011</value>
   <description>
    <narrative xml:lang="EN">Commitment from DFID April 1, 2016 to March 31, 2020</narrative>
   </description>
   <provider-org provider-activity-id="GB-1-203177-101" ref="GB-GOV-1" type="10">
    <narrative xml:lang="EN">DFID</narrative>
   </provider-org>
   <receiver-org receiver-activity-id="US-EIN-132890727-001" ref="US-EIN-132890727" type="80">
    <narrative xml:lang="EN">Guttmacher</narrative>
   </receiver-org>
  </transaction>
  <transaction ref="Dutch Commitment">
   <transaction-type code="11"></transaction-type>
   <transaction-date iso-date="2017-01-01"></transaction-date>
   <value currency="USD" value-date="2017-01-01">7500000</value>
   <description>
    <narrative xml:lang="EN">Commitment from Dutch MFA January 1, 2017 to December 31, 2021</narrative>
   </description>
   <provider-org provider-activity-id="XM-DAC-7-PPR-4000000282" ref="XM-DAC-7" type="10">
    <narrative xml:lang="EN">Dutch MFA</narrative>
   </provider-org>
   <receiver-org receiver-activity-id="US-EIN-132890727-001" ref="US-EIN-132890727" type="80">
    <narrative xml:lang="EN">Guttmacher</narrative>
   </receiver-org>
  </transaction>
  <transaction ref="Q2-Q32017 Expenditure">
   <transaction-type code="4"></transaction-type>
   <transaction-date iso-date="2017-09-30"></transaction-date>
   <value currency="USD" value-date="2017-09-30">3805941.67</value>
   <description>
    <narrative xml:lang="EN">Expenditures of DFID and Dutch MFA funds April 1, 2016 to September 30, 2017</narrative>
   </description>
   <provider-org provider-activity-id="US-EIN-132890727-001" ref="US-EIN-132890727" type="80">
    <narrative xml:lang="EN">Guttmacher</narrative>
   </provider-org>
  </transaction>
  <transaction ref="Q2 2018 Expenditure">
   <transaction-type code="4"></transaction-type>
   <transaction-date iso-date="2018-06-30"></transaction-date>
   <value currency="USD" value-date="2018-06-30">1367372.01</value>
   <description>
    <narrative xml:lang="EN">Expenditures of DFID and Dutch funds Apr 1, 2018 to Jun 30, 2018</narrative>
   </description>
   <provider-org provider-activity-id="US-EIN-132890727-001" ref="US-EIN-132890727" type="80">
    <narrative xml:lang="EN">Guttmacher</narrative>
   </provider-org>
  </transaction>
  <transaction ref="Q2 2019 Expenditure">
   <transaction-type code="4"></transaction-type>
   <transaction-date iso-date="2019-06-30"></transaction-date>
   <value currency="USD" value-date="2019-06-30">1314119.93</value>
   <description>
    <narrative xml:lang="EN">Expenditures of DFID and Dutch funds Apr 1, 2019 to Jun 30, 2019</narrative>
   </description>
   <provider-org provider-activity-id="US-EIN-132890727-001" ref="US-EIN-132890727" type="80"></provider-org>
  </transaction>
  <transaction ref="Q2 2021 Expenditure">
   <transaction-type code="4"></transaction-type>
   <transaction-date iso-date="2021-06-30"></transaction-date>
   <value currency="USD" value-date="2021-06-30">1675115.48</value>
   <description>
    <narrative xml:lang="EN">Expenditures of DFID and Dutch funds Apr 1, 2021 to Jun 30, 2021</narrative>
   </description>
   <provider-org provider-activity-id="US-EIN-132890727-001" ref="US-EIN-132890727" type="80">
    <narrative xml:lang="EN">Guttmacher</narrative>
   </provider-org>
  </transaction>
  <transaction ref="Q2 2020 Expenditure">
   <transaction-type code="4"></transaction-type>
   <transaction-date iso-date="2020-06-30"></transaction-date>
   <value currency="USD" value-date="2020-06-30">2154251.53</value>
   <description>
    <narrative xml:lang="EN">Expenditures of DFID and Dutch funds April 1, 2020 to June 30, 2020</narrative>
   </description>
   <provider-org provider-activity-id="US-EIN-132890727-001" ref="US-EIN-132890727" type="80">
    <narrative xml:lang="EN">Guttmacher</narrative>
   </provider-org>
  </transaction>
  <transaction ref="Q1 2019 Expenditure">
   <transaction-type code="4"></transaction-type>
   <transaction-date iso-date="2019-03-31"></transaction-date>
   <value currency="USD" value-date="2019-03-31">1161610.62</value>
   <description>
    <narrative xml:lang="EN">Expenditures of DFID and Dutch funds Jan 1, 2019 to Mar 31, 2019</narrative>
   </description>
   <provider-org provider-activity-id="US-EIN-132890727-001" ref="US-EIN-132890727" type="80">
    <narrative xml:lang="EN">Guttmacher</narrative>
   </provider-org>
  </transaction>
  <transaction ref="Q1 2021 Expenditure">
   <transaction-type code="4"></transaction-type>
   <transaction-date iso-date="2021-03-31"></transaction-date>
   <value currency="USD" value-date="2021-03-31">627115.56</value>
   <description>
    <narrative xml:lang="EN">Expenditures of DFID and Dutch funds Jan 1, 2021 to Mar 31, 2021</narrative>
   </description>
   <provider-org provider-activity-id="US-EIN-132890727-001" ref="US-EIN-132890727" type="80">
    <narrative xml:lang="EN">Guttmacher</narrative>
   </provider-org>
  </transaction>
  <transaction ref="Q12018 Expenditure">
   <transaction-type code="4"></transaction-type>
   <transaction-date iso-date="2018-03-31"></transaction-date>
   <value currency="USD" value-date="2018-03-31">1204448.4</value>
   <description>
    <narrative xml:lang="EN">Expenditures of DFID and Dutch funds January 1, 2018 to March 31, 2018</narrative>
   </description>
   <provider-org provider-activity-id="US-EIN-132890727-001" ref="US-EIN-132890727" type="80">
    <narrative xml:lang="EN">Guttmacher</narrative>
   </provider-org>
  </transaction>
  <transaction ref="Q1 2020 Expenditure">
   <transaction-type code="4"></transaction-type>
   <transaction-date iso-date="2020-03-31"></transaction-date>
   <value currency="USD" value-date="2020-03-31">1496674.16</value>
   <description>
    <narrative xml:lang="EN">Expenditures of DFID and Dutch funds January 1, 2020 to Mar 31, 2020</narrative>
   </description>
   <provider-org provider-activity-id="US-EIN-132890727-001" ref="US-EIN-132890727" type="80">
    <narrative xml:lang="EN">Guttmacher</narrative>
   </provider-org>
  </transaction>
  <transaction ref="Q3 2021 Expenditure">
   <transaction-type code="4"></transaction-type>
   <transaction-date iso-date="2021-09-30"></transaction-date>
   <value currency="USD" value-date="2021-09-30">2442475.99</value>
   <description>
    <narrative xml:lang="EN">Expenditures of DFID and Dutch funds Jul  1, 2021 to Sept 30, 2021</narrative>
   </description>
   <provider-org provider-activity-id="US-EIN-132890727-001" ref="US-EIN-132890727" type="80">
    <narrative xml:lang="EN">Guttmacher</narrative>
   </provider-org>
  </transaction>
  <transaction ref="Q3 2018 Expenditure">
   <transaction-type code="4"></transaction-type>
   <transaction-date iso-date="2018-09-30"></transaction-date>
   <value currency="USD" value-date="2018-09-30">1015502.23</value>
   <description>
    <narrative xml:lang="EN">Expenditures of DFID and Dutch funds Jul 1, 2018 to Sept 30, 2018</narrative>
   </description>
   <provider-org provider-activity-id="US-EIN-132890727-001" ref="US-EIN-132890727" type="80">
    <narrative xml:lang="EN">Guttmacher</narrative>
   </provider-org>
  </transaction>
  <transaction ref="Q3 2019 Expenditure">
   <transaction-type code="4"></transaction-type>
   <transaction-date iso-date="2019-09-30"></transaction-date>
   <value currency="USD" value-date="2019-09-30">1215372.41</value>
   <description>
    <narrative xml:lang="EN">Expenditures of DFID and Dutch funds Jul 1, 2019 to Sept 30, 2019</narrative>
   </description>
   <provider-org provider-activity-id="US-EIN-132890727-001" ref="US-EIN-132890727" type="80">
    <narrative xml:lang="EN">Guttmacher</narrative>
   </provider-org>
  </transaction>
  <transaction ref="Q3 2020 Expenditures">
   <transaction-type code="4"></transaction-type>
   <transaction-date iso-date="2020-09-30"></transaction-date>
   <value currency="USD" value-date="2020-09-30">2924493.01</value>
   <description>
    <narrative xml:lang="EN">Expenditures of DFID and Dutch funds Jul 1, 2020 to Sept 31, 2020</narrative>
   </description>
   <provider-org provider-activity-id="US-EIN-132890727-001" ref="US-EIN-132890727" type="80">
    <narrative xml:lang="EN">Guttmacher</narrative>
   </provider-org>
  </transaction>
  <transaction ref="Q4 2018 Expenditure">
   <transaction-type code="4"></transaction-type>
   <transaction-date iso-date="2018-12-31"></transaction-date>
   <value currency="USD" value-date="2018-12-31">1064014.19</value>
   <description>
    <narrative xml:lang="EN">Expenditures of DFID and Dutch funds Oct 1, 2018 to Dec 31, 2018</narrative>
   </description>
   <provider-org provider-activity-id="US-EIN-132890727-001" ref="US-EIN-132890727" type="80">
    <narrative xml:lang="EN">Guttmacher</narrative>
   </provider-org>
  </transaction>
  <transaction ref="Q4 2019 Expenditure">
   <transaction-type code="4"></transaction-type>
   <transaction-date iso-date="2020-12-31"></transaction-date>
   <value currency="USD" value-date="2020-12-31">4840962.5</value>
   <description>
    <narrative xml:lang="EN">Expenditures of DFID and Dutch funds Oct 1, 2019 to Dec 31, 2019</narrative>
   </description>
   <provider-org provider-activity-id="US-EIN-132890727-001" ref="US-EIN-132890727" type="80">
    <narrative xml:lang="EN">Guttmacher</narrative>
   </provider-org>
  </transaction>
  <transaction ref="Q4 2020 Expenditure">
   <transaction-type code="4"></transaction-type>
   <transaction-date iso-date="2020-12-31"></transaction-date>
   <value currency="USD" value-date="2020-12-31">3684161.94</value>
   <description>
    <narrative xml:lang="EN">Expenditures of DFID and Dutch funds Oct 1, 2020 to Dec 31, 2020</narrative>
   </description>
   <provider-org provider-activity-id="US-EIN-132890727-001" ref="US-EIN-132890727" type="80">
    <narrative xml:lang="EN">Guttmacher</narrative>
   </provider-org>
  </transaction>
  <transaction ref="Q4 2021 Expenditure">
   <transaction-type code="4"></transaction-type>
   <transaction-date iso-date="2021-12-31"></transaction-date>
   <value currency="USD" value-date="2021-12-31">705535.57</value>
   <description>
    <narrative xml:lang="EN">Expenditures of DFID and Dutch funds Oct 31, 2022 to Dec 21, 2022</narrative>
   </description>
   <provider-org provider-activity-id="US-EIN-132890727-001" ref="US-EIN-132890727" type="80">
    <narrative xml:lang="EN">Guttmacher</narrative>
   </provider-org>
  </transaction>
  <transaction ref="Q4 2017 Expenditure">
   <transaction-type code="4"></transaction-type>
   <transaction-date iso-date="2017-12-31"></transaction-date>
   <value currency="USD" value-date="2017-12-31">1486997.46</value>
   <description>
    <narrative xml:lang="EN">Expenditures of DFID and Dutch funds October 1, 2017 to December 31, 2017</narrative>
   </description>
   <provider-org provider-activity-id="US-EIN-132890727-001" ref="US-EIN-132890727" type="80">
    <narrative xml:lang="EN">Guttmacher</narrative>
   </provider-org>
  </transaction>
  <transaction ref="DFID Payment 8/6/18">
   <transaction-type code="1"></transaction-type>
   <transaction-date iso-date="2018-08-06"></transaction-date>
   <value currency="USD" value-date="2018-08-06">886883.62</value>
   <description>
    <narrative xml:lang="EN">Payment from DFID</narrative>
   </description>
   <provider-org provider-activity-id="GB-1-203177-101" ref="GB-GOV-1" type="10">
    <narrative xml:lang="EN">DFID</narrative>
   </provider-org>
   <receiver-org receiver-activity-id="US-EIN-132890727-001" ref="US-EIN-132890727" type="80">
    <narrative xml:lang="EN">Guttmacher</narrative>
   </receiver-org>
  </transaction>
  <transaction ref="DFID Payment 12/31/2019">
   <transaction-type code="1"></transaction-type>
   <transaction-date iso-date="2019-12-31"></transaction-date>
   <value currency="USD" value-date="2019-12-31">713068.82</value>
   <description>
    <narrative xml:lang="EN">Payment from DFID</narrative>
   </description>
   <provider-org provider-activity-id="GB-1-203177-101" ref="GB-GOV-1" type="10">
    <narrative xml:lang="EN">DFID</narrative>
   </provider-org>
   <receiver-org receiver-activity-id="US-EIN-132890727-001" ref="US-EIN-132890727" type="80">
    <narrative xml:lang="EN">Guttmacher</narrative>
   </receiver-org>
  </transaction>
  <transaction ref="DFID Payment 2/1/2020">
   <transaction-type code="1"></transaction-type>
   <transaction-date iso-date="2020-02-01"></transaction-date>
   <value currency="USD" value-date="2020-02-01">556682.12</value>
   <description>
    <narrative xml:lang="EN">Payment from DFID</narrative>
   </description>
   <provider-org provider-activity-id="GB-1-203177-101" ref="GB-GOV-1" type="10">
    <narrative xml:lang="EN">DFID</narrative>
   </provider-org>
   <receiver-org receiver-activity-id="US-EIN-132890727-001" ref="US-EIN-132890727" type="80">
    <narrative xml:lang="EN">Guttmacher</narrative>
   </receiver-org>
  </transaction>
  <transaction ref="DFID Payment 3/31/2020">
   <transaction-type code="1"></transaction-type>
   <transaction-date iso-date="2020-03-31"></transaction-date>
   <value currency="USD" value-date="2020-03-31">569142.15</value>
   <description>
    <narrative xml:lang="EN">Payment from DFID</narrative>
   </description>
   <provider-org provider-activity-id="GB-1-203177-101" ref="GB-GOV-1" type="10">
    <narrative xml:lang="EN">DFID</narrative>
   </provider-org>
   <receiver-org receiver-activity-id="US-EIN-132890727-001" ref="US-EIN-132890727" type="80">
    <narrative xml:lang="EN">Guttmacher</narrative>
   </receiver-org>
  </transaction>
  <transaction ref="DFID Payment 9/30/2020">
   <transaction-type code="1"></transaction-type>
   <transaction-date iso-date="2020-09-30"></transaction-date>
   <value currency="USD" value-date="2020-09-30">485616.93</value>
   <description>
    <narrative xml:lang="EN">Payment from DFID</narrative>
   </description>
   <provider-org provider-activity-id="GB-1-203177-101" ref="GB-GOV-1" type="10">
    <narrative xml:lang="EN">DFID</narrative>
   </provider-org>
   <receiver-org receiver-activity-id="US-EIN-132890727-001" ref="US-EIN-132890727" type="80">
    <narrative xml:lang="EN">Guttmacher</narrative>
   </receiver-org>
  </transaction>
  <transaction ref="DFID Payment 12/31/2020">
   <transaction-type code="1"></transaction-type>
   <transaction-date iso-date="2020-12-31"></transaction-date>
   <value currency="USD" value-date="2020-12-31">304822.67</value>
   <description>
    <narrative xml:lang="EN">Payment from DFID</narrative>
   </description>
   <provider-org provider-activity-id="GB-1-203177-101" ref="GB-GOV-1" type="10">
    <narrative xml:lang="EN">DFID</narrative>
   </provider-org>
   <receiver-org receiver-activity-id="US-EIN-132890727-001" ref="US-EIN-132890727" type="80">
    <narrative xml:lang="EN">Guttmacher</narrative>
   </receiver-org>
  </transaction>
  <transaction ref="DFID Payment 3/31/2021">
   <transaction-type code="1"></transaction-type>
   <transaction-date iso-date="2021-03-31"></transaction-date>
   <value currency="USD" value-date="2021-03-31">316341.37</value>
   <description>
    <narrative xml:lang="EN">Payment from DFID</narrative>
   </description>
   <provider-org provider-activity-id="GB-1-203177-101" ref="GB-GOV-1" type="10">
    <narrative xml:lang="EN">DFID</narrative>
   </provider-org>
   <receiver-org receiver-activity-id="US-EIN-132890727-001" ref="US-EIN-132890727" type="80">
    <narrative xml:lang="EN">Guttmacher</narrative>
   </receiver-org>
  </transaction>
  <transaction ref="DFID Payment 6/30/2021">
   <transaction-type code="1"></transaction-type>
   <transaction-date iso-date="2021-06-30"></transaction-date>
   <value currency="USD" value-date="2021-06-30">161023.5</value>
   <description>
    <narrative xml:lang="EN">Payment from DFID</narrative>
   </description>
   <provider-org provider-activity-id="GB-1-203177-101" ref="GB-GOV-1" type="10">
    <narrative xml:lang="EN">DFID</narrative>
   </provider-org>
   <receiver-org receiver-activity-id="US-EIN-132890727-001" ref="US-EIN-132890727" type="80">
    <narrative xml:lang="EN">Guttmacher</narrative>
   </receiver-org>
  </transaction>
  <transaction ref="DFID Payment 9/30/2021">
   <transaction-type code="1"></transaction-type>
   <transaction-date iso-date="2021-09-30"></transaction-date>
   <value currency="USD" value-date="2021-09-30">169760.73</value>
   <description>
    <narrative xml:lang="EN">Payment from DFID</narrative>
   </description>
   <provider-org provider-activity-id="GB-1-203177-101" ref="GB-GOV-1" type="10">
    <narrative xml:lang="EN">DFID</narrative>
   </provider-org>
   <receiver-org receiver-activity-id="US-EIN-132890727-001" ref="US-EIN-132890727" type="80">
    <narrative xml:lang="EN">Guttmacher</narrative>
   </receiver-org>
  </transaction>
  <transaction ref="DFID Payment 12/31/2021">
   <transaction-type code="1"></transaction-type>
   <transaction-date iso-date="2021-12-31"></transaction-date>
   <value currency="USD" value-date="2021-12-31">90222.87</value>
   <description>
    <narrative xml:lang="EN">Payment from DFID</narrative>
   </description>
   <provider-org provider-activity-id="GB-1-203177-101" ref="GB-GOV-1" type="10">
    <narrative xml:lang="EN">DFID</narrative>
   </provider-org>
   <receiver-org receiver-activity-id="US-EIN-132890727-001" ref="US-EIN-132890727" type="80">
    <narrative xml:lang="EN">Guttmacher</narrative>
   </receiver-org>
  </transaction>
  <transaction ref="DFID Payment 5/25/2022">
   <transaction-type code="1"></transaction-type>
   <transaction-date iso-date="2022-05-25"></transaction-date>
   <value currency="USD" value-date="2022-05-25">85891.52</value>
   <description>
    <narrative xml:lang="EN">Payment from DFID</narrative>
   </description>
   <provider-org provider-activity-id="GB-1-203177-101" ref="GB-GOV-1" type="10">
    <narrative xml:lang="EN">DFID</narrative>
   </provider-org>
   <receiver-org receiver-activity-id="US-EIN-132890727-001" ref="US-EIN-132890727" type="80">
    <narrative xml:lang="EN">Guttmacher</narrative>
   </receiver-org>
  </transaction>
  <transaction ref="DFID Payment 5/16/16">
   <transaction-type code="1"></transaction-type>
   <transaction-date iso-date="2016-05-16"></transaction-date>
   <value currency="USD" value-date="2016-05-16">277597.47</value>
   <description>
    <narrative xml:lang="EN">Payment from DFID</narrative>
   </description>
   <provider-org provider-activity-id="GB-1-203177-101" ref="GB-GOV-1" type="10">
    <narrative xml:lang="EN">DFID</narrative>
   </provider-org>
  </transaction>
  <transaction ref="DFID Payment 8/1/16">
   <transaction-type code="1"></transaction-type>
   <transaction-date iso-date="2016-08-01"></transaction-date>
   <value currency="USD" value-date="2016-08-01">382463.35</value>
   <description>
    <narrative xml:lang="EN">Payment from DFID</narrative>
   </description>
   <provider-org provider-activity-id="GB-1-203177-101" ref="GB-GOV-1" type="10">
    <narrative xml:lang="EN">DFID</narrative>
   </provider-org>
  </transaction>
  <transaction ref="DFID Payment 10/25/16">
   <transaction-type code="1"></transaction-type>
   <transaction-date iso-date="2016-10-25"></transaction-date>
   <value currency="USD" value-date="2016-10-25">627653.48</value>
   <description>
    <narrative xml:lang="EN">Payment from DFID</narrative>
   </description>
   <provider-org provider-activity-id="GB-1-203177-101" ref="GB-GOV-1" type="10">
    <narrative xml:lang="EN">DFID</narrative>
   </provider-org>
  </transaction>
  <transaction ref="DFID Payment 4/26/17">
   <transaction-type code="1"></transaction-type>
   <transaction-date iso-date="2017-04-26"></transaction-date>
   <value currency="USD" value-date="2017-04-26">1064425.07</value>
   <description>
    <narrative xml:lang="EN">Payment from DFID</narrative>
   </description>
   <provider-org provider-activity-id="GB-1-203177-101" ref="GB-GOV-1" type="10">
    <narrative xml:lang="EN">DFID</narrative>
   </provider-org>
  </transaction>
  <transaction ref="DFID Payment 8/1/17">
   <transaction-type code="1"></transaction-type>
   <transaction-date iso-date="2017-08-01"></transaction-date>
   <value currency="USD" value-date="2017-08-01">620990.36</value>
   <description>
    <narrative xml:lang="EN">Payment from DFID</narrative>
   </description>
   <provider-org provider-activity-id="GB-1-203177-101" ref="GB-GOV-1" type="10">
    <narrative xml:lang="EN">DFID</narrative>
   </provider-org>
  </transaction>
  <transaction ref="DFID Payment 11/1/17">
   <transaction-type code="1"></transaction-type>
   <transaction-date iso-date="2017-11-01"></transaction-date>
   <value currency="USD" value-date="2017-11-01">451171.24</value>
   <description>
    <narrative xml:lang="EN">Payment from DFID</narrative>
   </description>
   <provider-org provider-activity-id="GB-1-203177-101" ref="GB-GOV-1" type="10">
    <narrative xml:lang="EN">DFID</narrative>
   </provider-org>
  </transaction>
  <transaction ref="DFID payment 1/24/18">
   <transaction-type code="1"></transaction-type>
   <transaction-date iso-date="2018-01-24"></transaction-date>
   <value currency="USD" value-date="2018-01-24">1157211.1</value>
   <description>
    <narrative xml:lang="EN">Payment from DFID</narrative>
   </description>
   <provider-org provider-activity-id="GB-1-203177-101" ref="GB-GOV-1" type="10">
    <narrative xml:lang="EN">DFID</narrative>
   </provider-org>
  </transaction>
  <transaction ref="DFID Payment 10/31/18">
   <transaction-type code="1"></transaction-type>
   <transaction-date iso-date="2018-10-31"></transaction-date>
   <value currency="USD" value-date="2018-10-31">683881.94</value>
   <description>
    <narrative xml:lang="EN">Payment from DFID</narrative>
   </description>
   <provider-org provider-activity-id="GB-1-203177-101" ref="GB-GOV-1" type="10"></provider-org>
   <receiver-org receiver-activity-id="US-EIN-132890727-001" ref="US-EIN-132890727" type="80">
    <narrative xml:lang="EN">Guttmacher</narrative>
   </receiver-org>
  </transaction>
  <transaction ref="DFID Payment 2/14/19">
   <transaction-type code="1"></transaction-type>
   <transaction-date iso-date="2019-02-14"></transaction-date>
   <value currency="USD" value-date="2019-02-14">719787.36</value>
   <description>
    <narrative xml:lang="EN">Payment from DFID</narrative>
   </description>
   <provider-org provider-activity-id="GB-1-203177-101" ref="GB-GOV-1" type="10"></provider-org>
   <receiver-org receiver-activity-id="US-EIN-132890727-001" ref="US-EIN-132890727" type="80">
    <narrative xml:lang="EN">Guttmacher</narrative>
   </receiver-org>
  </transaction>
  <transaction ref="DFID Payment 8/12/19">
   <transaction-type code="1"></transaction-type>
   <transaction-date iso-date="2019-08-13"></transaction-date>
   <value currency="USD" value-date="2019-08-13">864625.14</value>
   <description>
    <narrative xml:lang="EN">Payment from DFID</narrative>
   </description>
   <provider-org provider-activity-id="GB-1-203177-101" ref="GB-GOV-1" type="10"></provider-org>
   <receiver-org receiver-activity-id="US-EIN-132890727-001" ref="US-EIN-132890727" type="80">
    <narrative xml:lang="EN">Guttmacher</narrative>
   </receiver-org>
  </transaction>
  <transaction ref="Dutch Payment 11/17/17">
   <transaction-type code="1"></transaction-type>
   <transaction-date iso-date="2017-11-17"></transaction-date>
   <value currency="USD" value-date="2017-11-17">1500000</value>
   <description>
    <narrative xml:lang="EN">Payment from Dutch MFA</narrative>
   </description>
   <provider-org provider-activity-id="XM-DAC-7-PPR-4000000282" ref="XM-DAC-7" type="10">
    <narrative xml:lang="EN">Dutch MFA</narrative>
   </provider-org>
   <receiver-org receiver-activity-id="US-EIN-132890727-001" ref="US-EIN-132890727" type="80">
    <narrative xml:lang="EN">Guttmacher</narrative>
   </receiver-org>
  </transaction>
  <transaction ref="Dutch Payment 9/30/2021">
   <transaction-type code="1"></transaction-type>
   <transaction-date iso-date="2021-09-30"></transaction-date>
   <value currency="USD" value-date="2021-09-30">563429.93</value>
   <description>
    <narrative xml:lang="EN">Payment from Dutch</narrative>
   </description>
   <provider-org provider-activity-id="XM-DAC-7-PPR-4000000282" ref="XM-DAC-7" type="10">
    <narrative xml:lang="EN">Dutch MFA</narrative>
   </provider-org>
   <receiver-org receiver-activity-id="US-EIN-132890727-001" ref="US-EIN-132890727" type="80">
    <narrative xml:lang="EN">Dutch MFA</narrative>
   </receiver-org>
  </transaction>
  <transaction ref="Dutch Payment 9/19/18">
   <transaction-type code="1"></transaction-type>
   <transaction-date iso-date="2018-09-19"></transaction-date>
   <value currency="USD" value-date="2018-09-19">1499980</value>
   <description>
    <narrative xml:lang="EN">Payment from Dutch</narrative>
   </description>
   <provider-org provider-activity-id="XM-DAC-7-PPR-4000000282" ref="XM-DAC-7" type="10">
    <narrative xml:lang="EN">Dutch MFA</narrative>
   </provider-org>
   <receiver-org receiver-activity-id="US-EIN-132890727-001" ref="US-EIN-132890727" type="80">
    <narrative xml:lang="EN">Guttmacher</narrative>
   </receiver-org>
  </transaction>
  <transaction ref="Dutch Payment 12/31/2019">
   <transaction-type code="1"></transaction-type>
   <transaction-date iso-date="2019-12-31"></transaction-date>
   <value currency="USD" value-date="2019-12-31">433113.62</value>
   <description>
    <narrative xml:lang="EN">Payment from Dutch</narrative>
   </description>
   <provider-org provider-activity-id="XM-DAC-7-PPR-4000000282" ref="XM-DAC-7" type="10">
    <narrative xml:lang="EN">Dutch MFA</narrative>
   </provider-org>
   <receiver-org receiver-activity-id="US-EIN-132890727-001" ref="US-EIN-132890727" type="80">
    <narrative xml:lang="EN">Guttmacher</narrative>
   </receiver-org>
  </transaction>
  <transaction ref="Dutch Payment 1/1/2020">
   <transaction-type code="1"></transaction-type>
   <transaction-date iso-date="2020-01-01"></transaction-date>
   <value currency="USD" value-date="2020-01-01">100895.23</value>
   <description>
    <narrative xml:lang="EN">Payment from Dutch</narrative>
   </description>
   <provider-org provider-activity-id="XM-DAC-7-PPR-4000000282" ref="XM-DAC-7" type="10">
    <narrative xml:lang="EN">Dutch MFA</narrative>
   </provider-org>
   <receiver-org receiver-activity-id="US-EIN-132890727-001" ref="US-EIN-132890727" type="80">
    <narrative xml:lang="EN">Guttmacher</narrative>
   </receiver-org>
  </transaction>
  <transaction ref="Dutch Payment 3/31/2020">
   <transaction-type code="1"></transaction-type>
   <transaction-date iso-date="2020-03-31"></transaction-date>
   <value currency="USD" value-date="2020-03-31">100895.24</value>
   <description>
    <narrative xml:lang="EN">Payment from Dutch</narrative>
   </description>
   <provider-org provider-activity-id="XM-DAC-7-PPR-4000000282" ref="XM-DAC-7" type="10">
    <narrative xml:lang="EN">Dutch MFA</narrative>
   </provider-org>
   <receiver-org receiver-activity-id="US-EIN-132890727-001" ref="US-EIN-132890727" type="80">
    <narrative xml:lang="EN">Guttmacher</narrative>
   </receiver-org>
  </transaction>
  <transaction ref="Dutch Payment 9/30/2020">
   <transaction-type code="1"></transaction-type>
   <transaction-date iso-date="2020-09-30"></transaction-date>
   <value currency="USD" value-date="2020-09-30">274318.02</value>
   <description>
    <narrative xml:lang="EN">Payment from Dutch</narrative>
   </description>
   <provider-org provider-activity-id="XM-DAC-7-PPR-4000000282" ref="XM-DAC-7" type="10">
    <narrative xml:lang="EN">Dutch MFA</narrative>
   </provider-org>
   <receiver-org receiver-activity-id="US-EIN-132890727-001" ref="US-EIN-132890727" type="80">
    <narrative xml:lang="EN">Guttmacher</narrative>
   </receiver-org>
  </transaction>
  <transaction ref="Dutch Payment 12/31/2020">
   <transaction-type code="1"></transaction-type>
   <transaction-date iso-date="2020-12-31"></transaction-date>
   <value currency="USD" value-date="2020-12-31">465152.79</value>
   <description>
    <narrative xml:lang="EN">Payment from Dutch</narrative>
   </description>
   <provider-org provider-activity-id="XM-DAC-7-PPR-4000000282" ref="XM-DAC-7" type="10">
    <narrative xml:lang="EN">Dutch MFA</narrative>
   </provider-org>
   <receiver-org receiver-activity-id="US-EIN-132890727-001" ref="US-EIN-132890727" type="80">
    <narrative xml:lang="EN">Guttmacher</narrative>
   </receiver-org>
  </transaction>
  <transaction ref="Dutch Payment 3/31/2021">
   <transaction-type code="1"></transaction-type>
   <transaction-date iso-date="2021-03-31"></transaction-date>
   <value currency="USD" value-date="2021-03-31">667435.18</value>
   <description>
    <narrative xml:lang="EN">Payment from Dutch</narrative>
   </description>
   <provider-org provider-activity-id="XM-DAC-7-PPR-4000000282" ref="XM-DAC-7" type="10">
    <narrative xml:lang="EN">Dutch MFA</narrative>
   </provider-org>
   <receiver-org receiver-activity-id="US-EIN-132890727-001" ref="US-EIN-132890727" type="80">
    <narrative xml:lang="EN">Guttmacher</narrative>
   </receiver-org>
  </transaction>
  <transaction ref="Dutch Payment 12/31/2021">
   <transaction-type code="1"></transaction-type>
   <transaction-date iso-date="2021-12-31"></transaction-date>
   <value currency="USD" value-date="2021-12-31">615312.7</value>
   <description>
    <narrative xml:lang="EN">Payment from Dutch</narrative>
   </description>
   <provider-org provider-activity-id="XM-DAC-7-PPR-4000000282" ref="XM-DAC-7" type="10">
    <narrative xml:lang="EN">Dutch MFA</narrative>
   </provider-org>
   <receiver-org receiver-activity-id="US-EIN-132890727-001" ref="US-EIN-132890727" type="80">
    <narrative xml:lang="EN">Guttmacher</narrative>
   </receiver-org>
  </transaction>
  <transaction ref="Dutch Payment 6/30/2021">
   <transaction-type code="1"></transaction-type>
   <transaction-date iso-date="2021-06-30"></transaction-date>
   <value currency="USD" value-date="2021-06-30">537919.73</value>
   <description>
    <narrative xml:lang="EN">Payment from the Dutch</narrative>
   </description>
   <provider-org provider-activity-id="XM-DAC-7-PPR-4000000282" ref="XM-DAC-7" type="10">
    <narrative xml:lang="EN">Dutch MFA</narrative>
   </provider-org>
   <receiver-org receiver-activity-id="US-EIN-132890727-001" ref="US-EIN-132890727" type="80">
    <narrative xml:lang="EN">Guttmacher</narrative>
   </receiver-org>
  </transaction>
  <transaction ref="Ipas Development Foundation Disbursement for Q1 2021">
   <transaction-type code="3"></transaction-type>
   <transaction-date iso-date="2021-03-31"></transaction-date>
   <value currency="USD" value-date="2021-03-31">8000</value>
   <description>
    <narrative xml:lang="EN">Subcontract Payment for Ipas Development Foundation</narrative>
   </description>
   <provider-org provider-activity-id="US-EIN-132890727-001" ref="US-EIN-132890727" type="80">
    <narrative xml:lang="EN">Guttmacher</narrative>
   </provider-org>
   <receiver-org receiver-activity-id="US-EIN-56-1071085-001" ref="US-EIN-56-1071085" type="80">
    <narrative xml:lang="EN">Ipas Development Foundation</narrative>
   </receiver-org>
  </transaction>
  <transaction ref="AHEAD Disbursement Q4 2021">
   <transaction-type code="3"></transaction-type>
   <transaction-date iso-date="2021-12-23"></transaction-date>
   <value currency="USD" value-date="2021-12-23">3583.87</value>
   <description>
    <narrative xml:lang="EN">Subcontract Payment to CRERD/AHEAD</narrative>
   </description>
   <provider-org provider-activity-id="US-EIN-132890727-001" ref="US-EIN-132890727" type="80">
    <narrative xml:lang="EN">Guttmacher</narrative>
   </provider-org>
   <receiver-org receiver-activity-id="NG-CAC-692943-AHEAD/CRERD_MISO_STUDY" ref="NG-CAC-692943" type="80">
    <narrative xml:lang="EN">CRERD/AHEAD</narrative>
   </receiver-org>
  </transaction>
  <transaction ref="Academy for Health Development Disbursement for Q2 2021">
   <transaction-type code="3"></transaction-type>
   <transaction-date iso-date="2021-04-02"></transaction-date>
   <value currency="USD" value-date="2021-04-02">2900</value>
   <description>
    <narrative xml:lang="EN">Subcontract payment for Academy for Health Development</narrative>
   </description>
   <provider-org provider-activity-id="US-EIN-132890727-001" ref="US-EIN-132890727" type="80">
    <narrative xml:lang="EN">Guttmacher</narrative>
   </provider-org>
   <receiver-org receiver-activity-id="NG-CAC-692943-AHEAD/CRERD_MISO_STUDY" ref="NG-CAC-692943" type="21">
    <narrative xml:lang="EN">Academy for Health Development</narrative>
   </receiver-org>
  </transaction>
  <transaction ref="Association for the Prevention of Unsafe Abortion, Bangladesh (BAPSA) Disbursement for Q3 2021">
   <transaction-type code="3"></transaction-type>
   <transaction-date iso-date="2021-07-22"></transaction-date>
   <value currency="USD" value-date="2021-07-22">11000</value>
   <description>
    <narrative xml:lang="EN">Subcontract payment for Association for the Prevention of Unsafe Abortion, Bangladesh (BAPSA)</narrative>
   </description>
   <provider-org provider-activity-id="US-EIN-132890727-001" ref="US-EIN-132890727" type="80">
    <narrative xml:lang="EN">Guttmacher</narrative>
   </provider-org>
   <receiver-org receiver-activity-id="BD-MEGPRB-SHIM-SHA-14-13-BE-BI-5-97-142-&quot;Designing a study on menstrual regulation and post-abortion care among the Rohingya refugees in Bangladesh.&#x201D;" ref="BD-NAB-0203" type="22">
    <narrative xml:lang="EN">Association for the Prevention of Unsafe Abortion, Bangladesh (BAPSA)</narrative>
   </receiver-org>
  </transaction>
  <transaction ref="Centre for Research Evaluation and Resources Development Disbursement for Q3 2021">
   <transaction-type code="3"></transaction-type>
   <transaction-date iso-date="2021-09-23"></transaction-date>
   <value currency="USD" value-date="2021-09-23">12250</value>
   <description>
    <narrative xml:lang="EN">Subcontract payment for Centre for Research Evaluation and Resources Development Disbursement for Q3 2021</narrative>
   </description>
   <provider-org provider-activity-id="US-EIN-132890727-001" ref="US-EIN-132890727" type="80">
    <narrative xml:lang="EN">Guttmacher</narrative>
   </provider-org>
   <receiver-org receiver-activity-id="NG-CAC-11660-QUALITY OF CARE OF MISOPROSTOL PROVISION IN NIGERIA" ref="NG-CAC-11660" type="22"></receiver-org>
  </transaction>
  <transaction ref="Ipas Development Foundation Disbursement for Q2 2021">
   <transaction-type code="3"></transaction-type>
   <transaction-date iso-date="2021-04-28"></transaction-date>
   <value currency="USD" value-date="2021-04-28">4000</value>
   <description>
    <narrative xml:lang="EN">Subcontract payment to  IPAS</narrative>
   </description>
   <provider-org provider-activity-id="US-EIN-132890727-001" ref="US-EIN-132890727" type="80">
    <narrative xml:lang="EN">Guttmacher</narrative>
   </provider-org>
   <receiver-org receiver-activity-id="US-EIN-56-1071085-001" ref="US-EIN-56-1071085" type="80">
    <narrative xml:lang="EN">Ipas Development Foundation</narrative>
   </receiver-org>
  </transaction>
  <transaction ref="ABAAD -Resource Center for Gender Equality-2nd disbursement_Q1_2020">
   <transaction-type code="3"></transaction-type>
   <transaction-date iso-date="2020-03-27"></transaction-date>
   <value currency="USD" value-date="2020-03-27">14165.95</value>
   <description>
    <narrative xml:lang="EN">Subcontract payment to ABAAD - Resource Center for Gender Equality</narrative>
   </description>
   <provider-org provider-activity-id="US-EIN-132890727-001" ref="US-EIN-132890727" type="80">
    <narrative xml:lang="EN">Guttmacher</narrative>
   </provider-org>
   <receiver-org receiver-activity-id="LB-MOI-497-US-EIN-13-2890727-001" ref="LB-MOI-497" type="22">
    <narrative xml:lang="EN">ABAAD - Resource Center for Gender Equality</narrative>
   </receiver-org>
  </transaction>
  <transaction ref="ABAAD -Resource Center for Gender Equality Disbursement Q2 2020">
   <transaction-type code="3"></transaction-type>
   <transaction-date iso-date="2020-03-26"></transaction-date>
   <value currency="USD" value-date="2020-03-26">14165.95</value>
   <description>
    <narrative xml:lang="EN">Subcontract payment to ABAAD -Resource Center for Gender Equality Disbursement</narrative>
   </description>
   <provider-org provider-activity-id="US-EIN-132890727-001" ref="US-EIN-132890727" type="80">
    <narrative xml:lang="EN">Guttmacher</narrative>
   </provider-org>
   <receiver-org receiver-activity-id="LB-MOI-497-US-EIN-13-2890727-001" ref="LB-MOI-497" type="22">
    <narrative xml:lang="EN">ABAAD -Resource Center for Gender Equality Disbursement</narrative>
   </receiver-org>
  </transaction>
  <transaction ref="AHEAD Disbursement Q42017">
   <transaction-type code="3"></transaction-type>
   <transaction-date iso-date="2017-11-03"></transaction-date>
   <value currency="USD" value-date="2017-11-03">82260.48</value>
   <description>
    <narrative xml:lang="EN">Subcontract payment to Academy for Health Development (AHEAD)</narrative>
   </description>
   <provider-org provider-activity-id="US-EIN-132890727-001" ref="US-EIN-132890727" type="80">
    <narrative xml:lang="EN">Guttmacher</narrative>
   </provider-org>
   <receiver-org receiver-activity-id="NG-CAC-692943-AHEAD/CRERD_MISO_STUDY" ref="NG-CAC-692943" type="80">
    <narrative xml:lang="EN">Academy for Health Development (AHEAD)</narrative>
   </receiver-org>
  </transaction>
  <transaction ref="AHEAD Disbursement Q2 2018">
   <transaction-type code="3"></transaction-type>
   <transaction-date iso-date="2018-06-01"></transaction-date>
   <value currency="USD" value-date="2018-06-01">117579.99</value>
   <description>
    <narrative xml:lang="EN">Subcontract payment to Academy for Health Development</narrative>
   </description>
   <provider-org provider-activity-id="US-EIN-132890727-001" ref="US-EIN-132890727" type="80">
    <narrative xml:lang="EN">Guttmacher</narrative>
   </provider-org>
   <receiver-org receiver-activity-id="NG-CAC-692943-AHEAD/CRERD_MISO_STUDY" ref="NG-CAC-692943" type="80">
    <narrative xml:lang="EN">Academy for Health Development (AHEAD)</narrative>
   </receiver-org>
  </transaction>
  <transaction ref="AHEAD Disbursement Q3 2018">
   <transaction-type code="3"></transaction-type>
   <transaction-date iso-date="2018-09-07"></transaction-date>
   <value currency="USD" value-date="2018-09-07">35840.48</value>
   <description>
    <narrative xml:lang="EN">Subcontract payment to Academy for Health Development</narrative>
   </description>
   <provider-org provider-activity-id="US-EIN-132890727-001" ref="US-EIN-132890727" type="80">
    <narrative xml:lang="EN">Guttmacher</narrative>
   </provider-org>
   <receiver-org receiver-activity-id="NG-CAC-692943-AHEAD/CRERD_MISO_STUDY" ref="NG-CAC-692943" type="80">
    <narrative xml:lang="EN">Academy for Health Development (AHEAD)</narrative>
   </receiver-org>
  </transaction>
  <transaction ref="Academy for Health Development Disbursement for Q4 2020">
   <transaction-type code="3"></transaction-type>
   <transaction-date iso-date="2020-12-14"></transaction-date>
   <value currency="USD" value-date="2020-12-14">5600</value>
   <description>
    <narrative xml:lang="EN">Subcontract payment to Academy for Health Development</narrative>
   </description>
   <provider-org provider-activity-id="US-EIN-132890727-001" ref="US-EIN-132890727" type="80">
    <narrative xml:lang="EN">Guttmacher</narrative>
   </provider-org>
   <receiver-org receiver-activity-id="NG-CAC-692943-AHEAD/CRERD_MISO_STUDY" ref="NG-CAC-692943" type="21">
    <narrative xml:lang="EN">Academy for Health Development</narrative>
   </receiver-org>
  </transaction>
  <transaction ref="Academy for Health Development_ Disbursement #3">
   <transaction-type code="3"></transaction-type>
   <transaction-date iso-date="2019-10-11"></transaction-date>
   <value currency="USD" value-date="2019-10-11">5961.29</value>
   <description>
    <narrative xml:lang="EN">Subcontract payment to Academy for Health Development</narrative>
   </description>
   <provider-org provider-activity-id="US-EIN-132890727-001" ref="US-EIN-132890727" type="80">
    <narrative xml:lang="EN">Guttmacher</narrative>
   </provider-org>
   <receiver-org receiver-activity-id="NG-CAC-692943-AHEAD/CRERD_MISO_STUDY" ref="NG-CAC-692943">
    <narrative xml:lang="EN">Academy for Health Development</narrative>
   </receiver-org>
  </transaction>
  <transaction ref="AHEAD disbursement Q12018">
   <transaction-type code="3"></transaction-type>
   <transaction-date iso-date="2018-03-23"></transaction-date>
   <value currency="USD" value-date="2018-03-23">4323</value>
   <description>
    <narrative xml:lang="EN">Subcontract payment to Academy for Health Development</narrative>
   </description>
   <receiver-org receiver-activity-id="NG-CAC-692943-AHEAD/CRERD_MISO_STUDY" ref="NG-CAC-692943" type="80">
    <narrative xml:lang="EN">Academy for Health Development (AHEAD)</narrative>
   </receiver-org>
  </transaction>
  <transaction ref="APHRC disbursement Q2 2017">
   <transaction-type code="3"></transaction-type>
   <transaction-date iso-date="2017-04-20"></transaction-date>
   <value currency="USD" value-date="2017-04-20">10000</value>
   <description>
    <narrative xml:lang="EN">Subcontract payment to African Population and Health Research Center</narrative>
   </description>
   <receiver-org receiver-activity-id="US-EIN-06-1608361-US-EIN-06-1608361" ref="US-EIN-06-1608361" type="21">
    <narrative xml:lang="EN">APHRC</narrative>
   </receiver-org>
  </transaction>
  <transaction ref="APHRC disbursement Q12018 (1)">
   <transaction-type code="3"></transaction-type>
   <transaction-date iso-date="2018-02-02"></transaction-date>
   <value currency="USD" value-date="2018-02-02">20000</value>
   <description>
    <narrative xml:lang="EN">Subcontract payment to African Population and Health Research Center</narrative>
   </description>
   <receiver-org receiver-activity-id="US-EIN-06-1608361-US-EIN-06-1608361" ref="US-EIN-06-1608361" type="21">
    <narrative xml:lang="EN">APHRC</narrative>
   </receiver-org>
  </transaction>
  <transaction ref="APHRC disbursement Q12018 (2)">
   <transaction-type code="3"></transaction-type>
   <transaction-date iso-date="2018-02-09"></transaction-date>
   <value currency="USD" value-date="2018-02-09">6715</value>
   <description>
    <narrative xml:lang="EN">Subcontract payment to African Population and Health Research Center</narrative>
   </description>
   <receiver-org receiver-activity-id="US-EIN-06-1608361-US-EIN-06-1608361" ref="US-EIN-06-1608361" type="21">
    <narrative xml:lang="EN">APHRC</narrative>
   </receiver-org>
  </transaction>
  <transaction ref="APHRC disbursement Q4 2018 (1)">
   <transaction-type code="3"></transaction-type>
   <transaction-date iso-date="2018-11-02"></transaction-date>
   <value currency="USD" value-date="2018-11-02">16400</value>
   <description>
    <narrative xml:lang="EN">Subcontract payment to African Population</narrative>
   </description>
   <receiver-org receiver-activity-id="US-EIN-06-1608361-US-EIN-06-1608361" ref="US-EIN-06-1608361" type="21"></receiver-org>
  </transaction>
  <transaction ref="APHRC disbursement Q4 2018 (2)">
   <transaction-type code="3"></transaction-type>
   <transaction-date iso-date="2018-11-02"></transaction-date>
   <value currency="USD" value-date="2018-11-02">25000</value>
   <description>
    <narrative xml:lang="EN">Subcontract payment to African Population</narrative>
   </description>
   <receiver-org receiver-activity-id="US-EIN-06-1608361-US-EIN-06-1608361" ref="US-EIN-06-1608361" type="21"></receiver-org>
  </transaction>
  <transaction ref="APHRC disbursement Q4 2018 (3)">
   <transaction-type code="3"></transaction-type>
   <transaction-date iso-date="2018-11-02"></transaction-date>
   <value currency="USD" value-date="2018-11-02">6715</value>
   <description>
    <narrative xml:lang="EN">Subcontract payment to African Population</narrative>
   </description>
   <receiver-org receiver-activity-id="US-EIN-06-1608361-US-EIN-06-1608361" ref="US-EIN-06-1608361" type="21"></receiver-org>
  </transaction>
  <transaction ref="Association for the Prevention of Unsafe Abortion, Bangladesh (BAPSA) Disbursement for Q3 2020">
   <transaction-type code="3"></transaction-type>
   <transaction-date iso-date="2020-09-24"></transaction-date>
   <value currency="USD" value-date="2020-09-24">12721.7</value>
   <description>
    <narrative xml:lang="EN">Subcontract payment to Association for the Prevention of Unsafe Abortion, Bangladesh (BAPSA)</narrative>
   </description>
   <provider-org provider-activity-id="US-EIN-132890727-001" ref="US-EIN-132890727" type="80">
    <narrative xml:lang="EN">Guttmacher</narrative>
   </provider-org>
   <receiver-org receiver-activity-id="BD-NAB-0203-MENSTRUAL REGULATION AND ABORTION AMONG ROHINGYA REFUGEES IN BANGLADESH" ref="BD-NAB-0203" type="22">
    <narrative xml:lang="EN">Association for the Prevention of Unsafe Abortion, Bangladesh (BAPSA)</narrative>
   </receiver-org>
  </transaction>
  <transaction ref="BRAC James P Grant School of Public Health, BRAC University-Disbursement Q3 2020">
   <transaction-type code="3"></transaction-type>
   <transaction-date iso-date="2020-09-17"></transaction-date>
   <value currency="USD" value-date="2020-09-17">23834.58</value>
   <description>
    <narrative xml:lang="EN">Subcontract payment to BRAC James P Grant School of Public Health, BRAC University</narrative>
   </description>
   <provider-org provider-activity-id="US-EIN-132890727-001" ref="US-EIN-132890727" type="80">
    <narrative xml:lang="EN">Guttmacher</narrative>
   </provider-org>
   <receiver-org receiver-activity-id="BD-MEGPRB-SHIM-SHA-14-13-BE-BI-5-97-142-&quot;Designing a study on menstrual regulation and post-abortion care among the Rohingya refugees in Bangladesh.&#x201D;" ref="XI-GRID-grid.52681.38" type="21">
    <narrative xml:lang="EN">BRAC James P Grant School of Public Health, BRAC University</narrative>
   </receiver-org>
  </transaction>
  <transaction ref="BRAC James P Grant School of Public Health, BRAC University-Disbursement Q2 2021">
   <transaction-type code="3"></transaction-type>
   <transaction-date iso-date="2021-04-02"></transaction-date>
   <value currency="USD" value-date="2021-04-02">7944.86</value>
   <description>
    <narrative xml:lang="EN">Subcontract payment to BRAC James P Grant School of Public Health, BRAC University</narrative>
   </description>
   <provider-org provider-activity-id="US-EIN-132890727-001" ref="US-EIN-132890727" type="80">
    <narrative xml:lang="EN">Guttmacher</narrative>
   </provider-org>
   <receiver-org receiver-activity-id="BD-MEGPRB-SHIM-SHA-14-13-BE-BI-5-97-142-&quot;Designing a study on menstrual regulation and post-abortion care among the Rohingya refugees in Bangladesh.&#x201D;" ref="XI-GRID-grid.52681.38" type="21">
    <narrative xml:lang="EN">BRAC James P Grant School of Public Health, BRAC University</narrative>
   </receiver-org>
  </transaction>
  <transaction ref="BRAC James P Grant School of Public Health, BRAC University-Disbursement Q4 2021 for Project 526">
   <transaction-type code="3"></transaction-type>
   <transaction-date iso-date="2021-12-27"></transaction-date>
   <value currency="USD" value-date="2021-12-27">8612</value>
   <description>
    <narrative xml:lang="EN">Subcontract payment to BRAC James P Grant School of Public Health, BRAC University</narrative>
   </description>
   <provider-org provider-activity-id="US-EIN-132890727-001" ref="US-EIN-132890727" type="80">
    <narrative xml:lang="EN">Guttmacher</narrative>
   </provider-org>
   <receiver-org receiver-activity-id="BD-MEGPRB-SHIM-SHA-14-13-BE-BI-5-97-142-&quot;Designing a study on menstrual regulation and post-abortion care among the Rohingya refugees in Bangladesh.&#x201D;" ref="XI-GRID-grid.52681.38" type="21">
    <narrative xml:lang="EN">BRAC James P Grant School of Public Health, BRAC University</narrative>
   </receiver-org>
  </transaction>
  <transaction ref="BRAC James P Grant School of Public Health, BRAC University-Disbursement 2 Q1 2021">
   <transaction-type code="3"></transaction-type>
   <transaction-date iso-date="2021-05-27"></transaction-date>
   <value currency="USD" value-date="2021-05-27">24224</value>
   <description>
    <narrative xml:lang="EN">Subcontract payment to BRAC James P Grant School of Public Health, BRAC University</narrative>
   </description>
   <provider-org provider-activity-id="US-EIN-132890727-001" ref="US-EIN-132890727" type="80">
    <narrative xml:lang="EN">Guttmacher</narrative>
   </provider-org>
   <receiver-org receiver-activity-id="BD-MEGPRB-SHIM-SHA-14-13-BE-BI-5-97-142-menstrual regulation (MR) and abortion among the Rohingya refugees in Bangladesh" ref="XI-GRID-grid.52681.38" type="22">
    <narrative xml:lang="EN">BRAC James P Grant School of Public Health, BRAC University</narrative>
   </receiver-org>
  </transaction>
  <transaction ref="BRAC James P Grant School of Public Health, BRAC University-Disbursement Q1 2021">
   <transaction-type code="3"></transaction-type>
   <transaction-date iso-date="2021-03-31"></transaction-date>
   <value currency="USD" value-date="2021-03-31">7944.86</value>
   <description>
    <narrative xml:lang="EN">Subcontract payment to BRAC James</narrative>
   </description>
   <provider-org provider-activity-id="US-EIN-132890727-001" ref="US-EIN-132890727" type="80">
    <narrative xml:lang="EN">Guttmacher</narrative>
   </provider-org>
   <receiver-org receiver-activity-id="BD-MEGPRB-SHIM-SHA-14-13-BE-BI-5-97-142-&quot;Designing a study on menstrual regulation and post-abortion care among the Rohingya refugees in Bangladesh.&#x201D;" ref="XI-GRID-grid.52681.38" type="22">
    <narrative xml:lang="EN">BRAC James P Grant School of Public Health, BRAC University</narrative>
   </receiver-org>
  </transaction>
  <transaction ref="BRAC James P Grant School of Public Health, BRAC University-Disbursement Q4 2021">
   <transaction-type code="3"></transaction-type>
   <transaction-date iso-date="2021-10-28"></transaction-date>
   <value currency="USD" value-date="2021-10-28">3500</value>
   <description>
    <narrative xml:lang="EN">Subcontract payment to BRAC October 2021</narrative>
   </description>
   <provider-org provider-activity-id="US-EIN-132890727-001" ref="US-EIN-132890727" type="80">
    <narrative xml:lang="EN">Guttmacher</narrative>
   </provider-org>
   <receiver-org receiver-activity-id="BD-MEGPRB-SHIM-SHA-14-13-BE-BI-5-97-142-&quot;Designing a study on menstrual regulation and post-abortion care among the Rohingya refugees in Bangladesh.&#x201D;" ref="XI-GRID-grid.52681.38" type="21">
    <narrative xml:lang="EN">BRAC James P Grant School of Public Health, BRAC University</narrative>
   </receiver-org>
  </transaction>
  <transaction ref="CREHPA Disbursement Q2 2018">
   <transaction-type code="3"></transaction-type>
   <transaction-date iso-date="2018-04-05"></transaction-date>
   <value currency="USD" value-date="2018-04-05">10000</value>
   <description>
    <narrative xml:lang="EN">Subcontract payment to CREHPA</narrative>
   </description>
   <provider-org provider-activity-id="US-EIN-132890727-001" ref="US-EIN-132890727" type="80">
    <narrative xml:lang="EN">Guttmacher</narrative>
   </provider-org>
   <receiver-org receiver-activity-id="NP-SWC-1844-http://crehpa.org.np/" ref="NP-SWC-1844" type="22">
    <narrative xml:lang="EN">CREHPA</narrative>
   </receiver-org>
  </transaction>
  <transaction ref="CREHPA disbursement Q4 2018">
   <transaction-type code="3"></transaction-type>
   <transaction-date iso-date="2018-11-16"></transaction-date>
   <value currency="USD" value-date="2018-11-16">11025</value>
   <description>
    <narrative xml:lang="EN">Subcontract payment to CREHPA</narrative>
   </description>
   <receiver-org receiver-activity-id="NP-SWC-1844-http://crehpa.org.np/" ref="NP-SWC-1844" type="22"></receiver-org>
  </transaction>
  <transaction ref="CREHPA Disbursement Q1 2019">
   <transaction-type code="3"></transaction-type>
   <transaction-date iso-date="2019-03-29"></transaction-date>
   <value currency="USD" value-date="2019-03-29">5512.5</value>
   <description>
    <narrative xml:lang="EN">Subcontract payment to CREHPA</narrative>
   </description>
   <receiver-org receiver-activity-id="NP-SWC-1844-http://crehpa.org.np/" ref="NP-SWC-1844" type="22"></receiver-org>
  </transaction>
  <transaction ref="CREHPA disbursement Q3 2019 1">
   <transaction-type code="3"></transaction-type>
   <transaction-date iso-date="2019-08-22"></transaction-date>
   <value currency="USD" value-date="2019-08-22">5512.5</value>
   <description>
    <narrative xml:lang="EN">Subcontract payment to CREHPA</narrative>
   </description>
   <receiver-org receiver-activity-id="NP-SWC-1844-http://crehpa.org.np/" ref="NP-SWC-1844" type="22"></receiver-org>
  </transaction>
  <transaction ref="CREHPA disbursement Q3 2019 2">
   <transaction-type code="3"></transaction-type>
   <transaction-date iso-date="2019-08-22"></transaction-date>
   <value currency="USD" value-date="2019-08-22">775</value>
   <description>
    <narrative xml:lang="EN">Subcontract payment to CREHPA</narrative>
   </description>
   <receiver-org receiver-activity-id="NP-SWC-1844-http://crehpa.org.np/" ref="NP-SWC-1844" type="22"></receiver-org>
  </transaction>
  <transaction ref="CRERD / AHEAD Disbursement Q2 2020">
   <transaction-type code="3"></transaction-type>
   <transaction-date iso-date="2020-03-27"></transaction-date>
   <value currency="USD" value-date="2020-03-27">3583.87</value>
   <description>
    <narrative xml:lang="EN">Subcontract payment to CRERD / AHEAD</narrative>
   </description>
   <provider-org provider-activity-id="US-EIN-132890727-001" ref="US-EIN-132890727" type="80">
    <narrative xml:lang="EN">Guttmacher</narrative>
   </provider-org>
   <receiver-org receiver-activity-id="NG-CAC-692943-AHEAD/CRERD_MISO_STUDY" ref="NG-CAC-692943" type="21">
    <narrative xml:lang="EN">CRERD / AHEAD</narrative>
   </receiver-org>
  </transaction>
  <transaction ref="CREHPA Disbursement Q42017">
   <transaction-type code="3"></transaction-type>
   <transaction-date iso-date="2017-11-17"></transaction-date>
   <value currency="USD" value-date="2017-11-17">10000</value>
   <description>
    <narrative xml:lang="EN">Subcontract payment to Center for Research on Environment Health and Population Activities (CREHPA)</narrative>
   </description>
   <receiver-org receiver-activity-id="NP-SWC-1844-http://crehpa.org.np/" ref="NP-SWC-1844" type="22">
    <narrative xml:lang="EN">Center for Research on Environment Health and Population Activities (CREHPA)</narrative>
   </receiver-org>
  </transaction>
  <transaction ref="Centre for Research Evaluation and Resources Development-disbursement _Q1">
   <transaction-type code="3"></transaction-type>
   <transaction-date iso-date="2020-03-26"></transaction-date>
   <value currency="USD" value-date="2020-03-26">3583.87</value>
   <description>
    <narrative xml:lang="EN">Subcontract payment to Centre for Research Evaluation and Resources Development CRERD / AHEAD</narrative>
   </description>
   <provider-org provider-activity-id="US-EIN-132890727-001" ref="US-EIN-132890727" type="80">
    <narrative xml:lang="EN">Guttmacher</narrative>
   </provider-org>
   <receiver-org receiver-activity-id="NG-CAC-692943-AHEAD/CRERD_MISO_STUDY" ref="NG-CAC-692943" type="21">
    <narrative xml:lang="EN">Centre for Research Evaluation and Resources Development CRERD / AHEAD</narrative>
   </receiver-org>
  </transaction>
  <transaction ref="Ethiopian Public Health Association Disbursement_Q3 2020">
   <transaction-type code="3"></transaction-type>
   <transaction-date iso-date="2020-09-24"></transaction-date>
   <value currency="USD" value-date="2020-09-24">21987</value>
   <description>
    <narrative xml:lang="EN">Subcontract payment to Ethiopian Public Health Association</narrative>
   </description>
   <provider-org provider-activity-id="US-EIN-132890727-001" ref="US-EIN-132890727" type="80">
    <narrative xml:lang="EN">Guttmacher</narrative>
   </provider-org>
   <receiver-org receiver-activity-id="ET-CSA-1351-COVID-SDP" ref="ET-CSA-1351" type="22">
    <narrative xml:lang="EN">Ethiopian Public Health Association</narrative>
   </receiver-org>
  </transaction>
  <transaction ref="Ethiopian Public Health Association Disbursement Q1 2021">
   <transaction-type code="3"></transaction-type>
   <transaction-date iso-date="2021-03-26"></transaction-date>
   <value currency="USD" value-date="2021-03-26">12643</value>
   <description>
    <narrative xml:lang="EN">Subcontract payment to Ethiopian Public Health Association</narrative>
   </description>
   <provider-org provider-activity-id="US-EIN-132890727-001" ref="US-EIN-132890727" type="80">
    <narrative xml:lang="EN">Guttmacher</narrative>
   </provider-org>
   <receiver-org receiver-activity-id="ET-CSA-1351-COVID-SDP" ref="ET-CSA-1351" type="22">
    <narrative xml:lang="EN">Ethiopian Public Health Association</narrative>
   </receiver-org>
  </transaction>
  <transaction ref="Orientame Disbursement Q42017">
   <transaction-type code="3"></transaction-type>
   <transaction-date iso-date="2017-12-31"></transaction-date>
   <value currency="USD" value-date="2017-12-31">89284</value>
   <description>
    <narrative xml:lang="EN">Subcontract payment to Fundacion Orientame</narrative>
   </description>
   <receiver-org ref="CO-RUE-860049972" type="22"></receiver-org>
  </transaction>
  <transaction ref="Orientame Disbursement Q2 2018">
   <transaction-type code="3"></transaction-type>
   <transaction-date iso-date="2018-06-14"></transaction-date>
   <value currency="USD" value-date="2018-06-14">13920.01</value>
   <description>
    <narrative xml:lang="EN">Subcontract payment to Fundaci&#xF3;n Orientame</narrative>
   </description>
   <provider-org provider-activity-id="US-EIN-132890727-001" ref="US-EIN-132890727" type="80">
    <narrative xml:lang="EN">Guttmacher</narrative>
   </provider-org>
   <receiver-org receiver-activity-id="CO-RUE-860049972-MisoprostolstudyinColombia" ref="CO-RUE-860049972" type="22">
    <narrative xml:lang="EN">Orientame</narrative>
   </receiver-org>
  </transaction>
  <transaction ref="International Youth Alliance for Family Planning Disbursement_Q3 2020">
   <transaction-type code="3"></transaction-type>
   <transaction-date iso-date="2020-07-30"></transaction-date>
   <value currency="USD" value-date="2020-07-30">5000</value>
   <description>
    <narrative xml:lang="EN">Subcontract payment to International Youth Alliance for Family Planning</narrative>
   </description>
   <provider-org provider-activity-id="US-EIN-132890727-001" ref="US-EIN-132890727" type="80">
    <narrative xml:lang="EN">Guttmacher</narrative>
   </provider-org>
   <receiver-org receiver-activity-id="US-EIN-47-5049026-001" ref="US-EIN-47-5049026" type="80">
    <narrative xml:lang="EN">International Youth Alliance for Family Planning</narrative>
   </receiver-org>
  </transaction>
  <transaction ref="Ipas Development Foundation Disbursement 2 for Q4 2020">
   <transaction-type code="3"></transaction-type>
   <transaction-date iso-date="2020-12-09"></transaction-date>
   <value currency="USD" value-date="2020-12-09">13000</value>
   <description>
    <narrative xml:lang="EN">Subcontract payment to Ipas Development Foundation</narrative>
   </description>
   <provider-org provider-activity-id="US-EIN-132890727-001" ref="US-EIN-132890727" type="80">
    <narrative xml:lang="EN">Guttmacher</narrative>
   </provider-org>
   <receiver-org receiver-activity-id="US-EIN-56-1071085-001" ref="US-EIN-56-1071085" type="80">
    <narrative xml:lang="EN">Ipas Development Foundation</narrative>
   </receiver-org>
  </transaction>
  <transaction ref="Ipas Development Foundation Disbursement for Q4 2020">
   <transaction-type code="3"></transaction-type>
   <transaction-date iso-date="2020-11-19"></transaction-date>
   <value currency="USD" value-date="2020-11-19">15000</value>
   <description>
    <narrative xml:lang="EN">Subcontract payment to Ipas Development Foundation</narrative>
   </description>
   <provider-org provider-activity-id="US-EIN-132890727-001" ref="US-EIN-132890727">
    <narrative xml:lang="EN">Guttmacher</narrative>
   </provider-org>
   <receiver-org receiver-activity-id="US-EIN-56-1071085-001" ref="US-EIN-56-1071085" type="80">
    <narrative xml:lang="EN">Ipas Development Foundation</narrative>
   </receiver-org>
  </transaction>
  <transaction ref="John Hopkins University -Final disbursement_Q1 2020">
   <transaction-type code="3"></transaction-type>
   <transaction-date iso-date="2020-02-18"></transaction-date>
   <value currency="USD" value-date="2020-02-18">9129</value>
   <description>
    <narrative xml:lang="EN">Subcontract payment to John Hopkins University</narrative>
   </description>
   <provider-org provider-activity-id="US-EIN-132890727-001" ref="US-EIN-132890727" type="80">
    <narrative xml:lang="EN">Guttmacher</narrative>
   </provider-org>
   <receiver-org receiver-activity-id="US-EIN-52-0595110-128174" ref="US-EIN-52-0595110" type="21">
    <narrative xml:lang="EN">John Hopkins University</narrative>
   </receiver-org>
  </transaction>
  <transaction ref="JHU disbursement Q12018">
   <transaction-type code="3"></transaction-type>
   <transaction-date iso-date="2018-02-28"></transaction-date>
   <value currency="USD" value-date="2018-02-28">67747</value>
   <description>
    <narrative xml:lang="EN">Subcontract payment to John Hopkins University</narrative>
   </description>
   <receiver-org receiver-activity-id="US-EIN-52-0595110-128174" ref="US-EIN-52-0595110" type="80">
    <narrative xml:lang="EN">Johns Hopkins University</narrative>
   </receiver-org>
  </transaction>
  <transaction ref="Johns Hopkins Disbursement Q42017">
   <transaction-type code="3"></transaction-type>
   <transaction-date iso-date="2017-12-31"></transaction-date>
   <value currency="USD" value-date="2017-12-31">67747</value>
   <description>
    <narrative xml:lang="EN">Subcontract payment to Johns Hopkins University</narrative>
   </description>
   <receiver-org receiver-activity-id="US-EIN-52-0595110-128174" ref="US-EIN-52-0595110" type="80"></receiver-org>
  </transaction>
  <transaction ref="Kwame Nkrumah University of Science and Technology Disbursement Q1 2021">
   <transaction-type code="3"></transaction-type>
   <transaction-date iso-date="2021-03-18"></transaction-date>
   <value currency="USD" value-date="2021-03-18">27668</value>
   <description>
    <narrative xml:lang="EN">Subcontract payment to Kwame Nkrumah University of Science and Technology</narrative>
   </description>
   <provider-org provider-activity-id="US-EIN-132890727-001" ref="US-EIN-132890727" type="80">
    <narrative xml:lang="EN">Guttmacher</narrative>
   </provider-org>
   <receiver-org receiver-activity-id="XI-GRID-grid.9829.a-KNUST-SPH/PMA-GI/1" ref="XI-GRID-grid.9829.a" type="21">
    <narrative xml:lang="EN">Kwame Nkrumah University of Science and Technology</narrative>
   </receiver-org>
  </transaction>
  <transaction ref="KNUST disbursement Q3 2019 1">
   <transaction-type code="3"></transaction-type>
   <transaction-date iso-date="2019-08-29"></transaction-date>
   <value currency="USD" value-date="2019-08-29">12000</value>
   <description>
    <narrative xml:lang="EN">Subcontract payment to Kwame Nkrumah University of Science and Technology</narrative>
   </description>
   <receiver-org receiver-activity-id="XI-GRID-grid.9829.a-KNUST-SPH/PMA-GI/" ref="XI-GRID-grid.9829.a" type="80"></receiver-org>
  </transaction>
  <transaction ref="KNUST disbursement Q3 2019 2">
   <transaction-type code="3"></transaction-type>
   <transaction-date iso-date="2019-08-29"></transaction-date>
   <value currency="USD" value-date="2019-08-29">17550</value>
   <description>
    <narrative xml:lang="EN">Subcontract payment to Kwame Nkrumah University of Science and Technology</narrative>
   </description>
   <receiver-org receiver-activity-id="XI-GRID-grid.9829.a-KNUST-SPH/PMA-GI/" ref="XI-GRID-grid.9829.a" type="80"></receiver-org>
  </transaction>
  <transaction ref="Kwame Nkrumah disbursement Q4 2018">
   <transaction-type code="3"></transaction-type>
   <transaction-date iso-date="2018-11-08"></transaction-date>
   <value currency="USD" value-date="2018-11-08">50000</value>
   <description>
    <narrative xml:lang="EN">Subcontract payment to Kwame Nkrumah University of Science and Technology</narrative>
   </description>
   <receiver-org receiver-activity-id="XI-GRID-grid.9829.a-KNUST-SPH/PMA-GI/1" ref="XI-GRID-grid.9829.a" type="80"></receiver-org>
  </transaction>
  <transaction ref="Kwame Nkrumah Disbursement Q42017">
   <transaction-type code="3"></transaction-type>
   <transaction-date iso-date="2017-12-21"></transaction-date>
   <value currency="USD" value-date="2017-12-21">282679</value>
   <description>
    <narrative xml:lang="EN">Subcontract payment to Kwame Nkrumah</narrative>
   </description>
   <receiver-org receiver-activity-id="XI-GRID-grid.9829.a-KNUST-SPH/PMA-GI/1" ref="XI-GRID-grid.9829.a" type="80"></receiver-org>
  </transaction>
  <transaction ref="PERU CIISS Disbursement Q1 2021">
   <transaction-type code="3"></transaction-type>
   <transaction-date iso-date="2021-01-31"></transaction-date>
   <value currency="USD" value-date="2021-01-31">3311.92</value>
   <description>
    <narrative xml:lang="EN">Subcontract payment to PERU CIISS</narrative>
   </description>
   <provider-org provider-activity-id="US-EIN-132890727-001" ref="US-EIN-132890727" type="80">
    <narrative xml:lang="EN">Guttmacher</narrative>
   </provider-org>
   <receiver-org>
    <narrative xml:lang="EN">PERU CIISS</narrative>
   </receiver-org>
  </transaction>
  <transaction ref="Population Council_ Disbursement #3">
   <transaction-type code="3"></transaction-type>
   <transaction-date iso-date="2019-12-31"></transaction-date>
   <value currency="USD" value-date="2019-12-31">5000</value>
   <description>
    <narrative xml:lang="EN">Subcontract payment to Population Council</narrative>
   </description>
   <provider-org provider-activity-id="US-EIN-132890727-001" ref="US-EIN-132890727" type="80">
    <narrative xml:lang="EN">Guttmacher</narrative>
   </provider-org>
   <receiver-org receiver-activity-id="US-EIN-13-1687001-US-EIN-13-2890727-001" ref="US-EIN-13-1687001" type="21">
    <narrative xml:lang="EN">Population Council</narrative>
   </receiver-org>
  </transaction>
  <transaction ref="Pop Council Disbursement Q42017">
   <transaction-type code="3"></transaction-type>
   <transaction-date iso-date="2017-12-31"></transaction-date>
   <value currency="USD" value-date="2017-12-31">33434</value>
   <description>
    <narrative xml:lang="EN">Subcontract payment to Population Council</narrative>
   </description>
   <receiver-org receiver-activity-id="US-EIN-13-1687001-US-EIN-13-2890727-001" ref="US-EIN-13-1687001" type="21"></receiver-org>
  </transaction>
  <transaction ref="RECONSTRA UTAMA INTEGRA PT Disbursement for Q3 2021">
   <transaction-type code="3"></transaction-type>
   <transaction-date iso-date="2021-08-12"></transaction-date>
   <value currency="USD" value-date="2021-08-12">2082</value>
   <description>
    <narrative xml:lang="EN">Subcontract payment to RECONSTRA UTAMA INTEGRA PT</narrative>
   </description>
   <provider-org provider-activity-id="US-EIN-132890727-001" ref="US-EIN-132890727" type="80">
    <narrative xml:lang="EN">Guttmacher</narrative>
   </provider-org>
   <receiver-org ref="ID-DJP-312666837412000" type="21">
    <narrative xml:lang="EN">RECONSTRA UTAMA INTEGRA PT</narrative>
   </receiver-org>
  </transaction>
  <transaction ref="Reconstra Disbursement Q42017">
   <transaction-type code="3"></transaction-type>
   <transaction-date iso-date="2017-11-17"></transaction-date>
   <value currency="USD" value-date="2017-11-17">17739.52</value>
   <description>
    <narrative xml:lang="EN">Subcontract payment to Reconstra Utama Integra PT</narrative>
   </description>
   <provider-org provider-activity-id="US-EIN-132890727-001" ref="US-EIN-132890727" type="80">
    <narrative xml:lang="EN">Guttmacher</narrative>
   </provider-org>
  </transaction>
  <transaction ref="Reconstra Disbursement Q1 2019">
   <transaction-type code="3"></transaction-type>
   <transaction-date iso-date="2019-02-21"></transaction-date>
   <value currency="USD" value-date="2019-02-21">58463.76</value>
   <description>
    <narrative xml:lang="EN">Subcontract payment to Reconstra Utama Integra PT</narrative>
   </description>
  </transaction>
  <transaction ref="Pop Council Disbursement Q2 2018">
   <transaction-type code="3"></transaction-type>
   <transaction-date iso-date="2018-05-18"></transaction-date>
   <value currency="USD" value-date="2018-05-18">16717</value>
   <description>
    <narrative xml:lang="EN">Subcontract payment to The Population Council</narrative>
   </description>
   <provider-org provider-activity-id="US-EIN-132890727-001" ref="US-EIN-132890727" type="80">
    <narrative xml:lang="EN">Guttmacher</narrative>
   </provider-org>
   <receiver-org receiver-activity-id="US-EIN-13-1687001-US-EIN-13-2890727-001" ref="US-EIN-13-1687001" type="21">
    <narrative xml:lang="EN">Population Council</narrative>
   </receiver-org>
  </transaction>
  <transaction ref="Pop Council disbursement Q3 2019 1">
   <transaction-type code="3"></transaction-type>
   <transaction-date iso-date="2019-07-30"></transaction-date>
   <value currency="USD" value-date="2019-07-30">10000</value>
   <description>
    <narrative xml:lang="EN">Subcontract payment to The Population Council</narrative>
   </description>
   <receiver-org receiver-activity-id="US-EIN-13-1687001-US-EIN-13-2890727-001" ref="US-EIN-13-1687001" type="21"></receiver-org>
  </transaction>
  <transaction ref="Pop Council disbursement Q3 2019 2">
   <transaction-type code="3"></transaction-type>
   <transaction-date iso-date="2019-09-25"></transaction-date>
   <value currency="USD" value-date="2019-09-25">10000</value>
   <description>
    <narrative xml:lang="EN">Subcontract payment to The Population Council</narrative>
   </description>
   <receiver-org receiver-activity-id="US-EIN-13-1687001-US-EIN-13-2890727-001" ref="US-EIN-13-1687001" type="21"></receiver-org>
  </transaction>
  <transaction ref="UZ-UCSF Disbursement Q1 2019">
   <transaction-type code="3"></transaction-type>
   <transaction-date iso-date="2019-02-21"></transaction-date>
   <value currency="USD" value-date="2019-02-21">18300.41</value>
   <description>
    <narrative xml:lang="EN">Subcontract payment to UZ-UCSF</narrative>
   </description>
   <receiver-org receiver-activity-id="XI-GRID-grid.13001.33-AbortionincidencestudyinZimbabwe" ref="XI-GRID-grid.13001.33" type="80"></receiver-org>
  </transaction>
  <transaction ref="Women&apos;s Action Group Disbursement Q42017">
   <transaction-type code="3"></transaction-type>
   <transaction-date iso-date="2017-12-31"></transaction-date>
   <value currency="USD" value-date="2017-12-31">14000</value>
   <description>
    <narrative xml:lang="EN">Subcontract payment to Women&apos;s Action Group</narrative>
   </description>
   <receiver-org receiver-activity-id="ZW-ROD-MA988-87-US-EIN-132890727-00" ref="ZW-ROD-MA988/87" type="22">
    <narrative xml:lang="EN">Women&apos;s Action Group</narrative>
   </receiver-org>
  </transaction>
  <transaction ref="Women&apos;s Action Group disbursement Q4 2018">
   <transaction-type code="3"></transaction-type>
   <transaction-date iso-date="2018-11-08"></transaction-date>
   <value currency="USD" value-date="2018-11-08">5000</value>
   <description>
    <narrative xml:lang="EN">Subcontract payment to Women&apos;s Action Group</narrative>
   </description>
   <receiver-org receiver-activity-id="ZW-ROD-MA988-87-US-EIN-132890727-00" ref="ZW-ROD-MA988/87" type="22"></receiver-org>
  </transaction>
  <transaction ref="UMATI Disbursement Q4 2021">
   <transaction-type code="3"></transaction-type>
   <transaction-date iso-date="2021-12-01"></transaction-date>
   <value currency="USD" value-date="2021-12-01">8754</value>
   <description>
    <narrative xml:lang="EN">Subcontractor payment to UMATI</narrative>
   </description>
   <provider-org provider-activity-id="US-EIN-132890727-001" ref="US-EIN-132890727" type="80">
    <narrative xml:lang="EN">Guttmacher</narrative>
   </provider-org>
   <receiver-org ref="TZ-TRA-101-304-795" type="22">
    <narrative xml:lang="EN">UMATI</narrative>
   </receiver-org>
  </transaction>
  <transaction ref="DFID Payment 6/10/19">
   <transaction-type code="1"></transaction-type>
   <transaction-date iso-date="2019-06-10"></transaction-date>
   <value currency="USD" value-date="2019-06-10">695007.72</value>
   <provider-org provider-activity-id="GB-1-203177-101" ref="GB-GOV-1" type="10"></provider-org>
   <receiver-org receiver-activity-id="US-EIN-132890727-001" ref="US-EIN-132890727" type="80"></receiver-org>
  </transaction>
  <transaction ref="Johns Hopkins Disbursement Q2 2019">
   <transaction-type code="3"></transaction-type>
   <transaction-date iso-date="2019-06-30"></transaction-date>
   <value currency="USD" value-date="2019-06-30">4098.08</value>
   <provider-org provider-activity-id="US-EIN-132890727-001" ref="US-EIN-132890727" type="80"></provider-org>
   <receiver-org receiver-activity-id="US-EIN-520595110-128174" ref="US-EIN-52-0595110" type="80"></receiver-org>
  </transaction>
  <transaction ref="University of Kinshasa Disbursement Q2 2019">
   <transaction-type code="3"></transaction-type>
   <transaction-date iso-date="2019-06-30"></transaction-date>
   <value currency="USD" value-date="2019-06-30">3000</value>
   <provider-org provider-activity-id="US-EIN-132890727-001" ref="US-EIN-132890727" type="80"></provider-org>
  </transaction>
  <document-link format="APPLICATION/PDF" url="https://aidstream.org/files/documents/GII-FS20-SIAR-Netherlands_FINAL-20210720010759.pdf">
   <title>
    <narrative xml:lang="EN">Guttmacher Institute 2020 Audit - Dutch Ministry of Foreign Affairs</narrative>
   </title>
   <category code="A05"></category>
   <language code="EN"></language>
  </document-link>
  <document-link format="APPLICATION/PDF" url="https://aidstream.org/files/documents/GII-FS20_FINAL-20210720010734.pdf">
   <title>
    <narrative xml:lang="EN">Guttmacher Institute 2020 Institutional Financial Audit</narrative>
   </title>
   <category code="A05"></category>
   <language code="EN"></language>
  </document-link>
  <document-link format="APPLICATION/PDF" url="https://aidstream.org/files/documents/Guttmacher-Narrative-Report-2019-(Dutch-Ministry-of-Foreign-Affairs)-20200701080713.pdf">
   <title>
    <narrative xml:lang="EN">Guttmacher 2019 Annual Narrative Report</narrative>
   </title>
   <category code="A08"></category>
   <language code="EN"></language>
   <document-date iso-date="2020-07-01"></document-date>
  </document-link>
  <document-link format="APPLICATION/PDF" url="https://aidstream.org/files/documents/Guttmacher-Institute_Interim-Narrative-Report-(Jan-Dec-2020)-20210720010730.pdf">
   <title>
    <narrative xml:lang="EN">Guttmacher Institute - Narrative Report 2020</narrative>
   </title>
   <category code="A08"></category>
   <language code="EN"></language>
  </document-link>
  <result type="2">
   <title>
    <narrative xml:lang="EN">New evidence is generated on abortion and related sexual and reproductive health issues and shared with the scientific community.</narrative>
   </title>
   <indicator measure="1">
    <title>
     <narrative xml:lang="EN">Number of complete, cleaned data sets</narrative>
    </title>
    <description>
     <narrative xml:lang="EN">Not all data sets will be made publicly available.</narrative>
    </description>
    <baseline iso-date="2021-12-07" value="0" year="2016"></baseline>
    <period>
     <period-start iso-date="2017-01-01"></period-start>
     <period-end iso-date="2021-12-31"></period-end>
     <target value="27"></target>
     <actual value="31">
      <comment>
       <narrative xml:lang="EN">(2017) Data sets completed for: global unintended pregnancy article; Adding It Up study; India abortion incidence study; Ethiopia adolescent abortion study; Uganda adolescent abortion study; study of gestational age and method of abortion in countries where abortion is legal; Kinshasa abortion incidence study; Zimbabwe abortion incidence study; study of inequalities in need for SRH services worldwide; study of the cost of unsafe abortion to the Senegal health system; comparative study on abortion in South Asia. (2018) Data sets completed for: Sub-Saharan Africa abortion monograph; 2018 Just the Numbers estimates; South Asia comparative abortion study; Adding It Up Pakistan estimates; Adding It Up Nepal estimates; maternal near-miss death in Kenya study; Ghana abortion incidence study; study on health systems&#x2019; capacity to provide post-abortion care. (2019) Data sets completed for: Adding It Up 4 report; worldwide abortion and unintended pregnancy estimates; study of cost of unsafe abortion to the Tanzanian health system; unintended pregnancy and experiences of sexual violence in Kinshasa; and Zimbabwe adolescent abortion incidence study.(2020) Data sets completed for: cost of unsafe abortion estimates in Senegal; online provision of misoprostol in Indonesia study; informal use of misoprostol in Colombia study; informal use of misoprostol in Nigeria study; abortion incidence estimates in Ghana; maternal near-miss estimates in Kenya; Kinshasa, DRC adolescent abortion incidence study. (2021) Adding It Up country-level estimates; country-level abortion and unintended pregnancy estimates; abortion-related maternal near-miss estimates in Nigeria and Central African Republic;</narrative>
      </comment>
     </actual>
    </period>
   </indicator>
   <indicator measure="1">
    <title>
     <narrative xml:lang="EN">Number of data sets uploaded to Guttmacher Data Center</narrative>
    </title>
    <baseline value="0" year="2016"></baseline>
    <period>
     <period-start iso-date="2017-01-01"></period-start>
     <period-end iso-date="2021-12-31"></period-end>
     <target value="4"></target>
     <actual value="4">
      <comment>
       <narrative xml:lang="EN">(2017) Data on need (met and unmet), costs, and benefits from 2017 Adding it Up report and on global unintended pregnancy estimates (2020) estimates from article on unintended pregnancy and abortion by income, region, and the legal status of abortion, data on need (met and unmet), costs, and benefits from 2019 Adding It Up report.</narrative>
      </comment>
     </actual>
    </period>
   </indicator>
   <indicator measure="1">
    <title>
     <narrative xml:lang="EN">Number of meetings at scholarly meetings and conferences</narrative>
    </title>
    <baseline value="0" year="2016"></baseline>
    <period>
     <period-start iso-date="2017-01-01"></period-start>
     <period-end iso-date="2021-12-31"></period-end>
     <target value="25"></target>
     <actual value="33">
      <comment>
       <narrative xml:lang="EN">(2017) Presented on Ethiopia and Uganda adolescent abortion studies and on Kinshasa abortion incidence study at 2017 International Population Conference; presented on abortion incidence in Zimbabwe, economic and health consequences of abortion in India, medication abortion provision in India, adolescent abortion in Ethiopia, and abortion incidence in Kinshasa at the 2017 Population Association of America annual meeting. (2018) Gave presentations at the 2018 Population Association of America annual meeting on using medication sales data to estimate abortion incidence in India, knowledge and attitudes towards healthcare providers in Zimbabwe, and worldwide unintended pregnancy estimates; gave presentations at the 2018 International Conference on Family Planning on worldwide unintended pregnancy, unmet need for contraception in Nepal, adolescent family planning projections, costs and benefits of family planning in Pakistan, abortion incidence in India, and global unmet need for contraception; gave presentation at the FIGO conference on abortion-related maternal mortality in 10 countries; gave presentation on the Guttmacher-Lancet Commission at the 2018 American Public Health Association annual conference; and gave presentation at the CLACAI conference on preliminary findings from the misoprostol study in Colombia.  (2019) Presented on Nepal Adding It Up study at the National Conference on Family Planning in Nepal; gave presentations at the 2019 Population Association of America annual meeting on developing an abortion classification process, incidence of maternal near-miss in Kenya, financial impact of maternal near-miss in Kenya, Bayesian methods for estimating abortion and unintended pregnancy incidence, informal access to misoprostol in Colombia, approaches to estimating abortion incidence in Ghana, trends in method and gestational age of abortion in high income countries, and experiences of obtaining medication abortion in Nigeria; presented on Adding It Up at Women Deliver side event; in-country partners presented on preliminary findings from the misoprostol study at the 1st International Conference on Indonesia Family Planning and Reproductive Health; preliminary findings from misoprostol study in Nigeria were  presented at the 8th African Conference on Population in November; and findings from the Tanzania costing study were presented at the 8th African Conference on Population.  (2020) Key Adding It Up findings presented as part of the webinar &#x201C;Universal Health Coverage and SRHR during COVID-19 and beyond&#x201D; in June 2020; Adding It Up findings were presented as a part of a webinar titled &#x201C;Adding it Up: Ensuring that Young People Count&#x201D; on International Youth Day in August 2020 (2021) Quantitative results from study on near-miss and morbidity due to unsafe abortion amongst Africans displaced due to fragility and conflict in CAR was presented at FIGO World Congress in October 2021; presentation on forthcoming scoping review on the impact of COVID-19 on the provision or and demand for SRH services was on December 6, 2021 at the International Population Conference (virtual).</narrative>
      </comment>
     </actual>
    </period>
   </indicator>
   <indicator measure="1">
    <title>
     <narrative xml:lang="EN">Number of technical reports published</narrative>
    </title>
    <baseline value="0" year="2016"></baseline>
    <period>
     <period-start iso-date="2017-01-01"></period-start>
     <period-end iso-date="2021-12-31"></period-end>
     <target value="5"></target>
     <actual value="6">
      <comment>
       <narrative xml:lang="EN">(2017) Published Adding It Up 2017 report in June 2017; Adding It Up methodology report in May 2018; and comparative report on abortion and unintended pregnancy in six Indian states in November 2018.  (2019) Published report on Unintended Pregnancy and Abortion in Kinshasa, Democratic Republic of Congo: Challenges and Progress. (2020) Published Adding It Up methodology report in July 2020; published report on abortion and unintended pregnancy in Sub-Saharan Africa</narrative>
      </comment>
     </actual>
    </period>
   </indicator>
   <indicator measure="1">
    <title>
     <narrative xml:lang="EN">Number of peer-reviewed journal articles published</narrative>
    </title>
    <baseline value="0" year="2016"></baseline>
    <period>
     <period-start iso-date="2017-01-01"></period-start>
     <period-end iso-date="2021-12-31"></period-end>
     <target value="25"></target>
     <actual value="36">
      <comment>
       <narrative xml:lang="EN">(2017) Published article on abortion incidence in Kinshasa, DRC in October 2017. (2018) Published article on postabortion morbidity in Zimbabwe in January 2018; published article on unintended pregnancy worldwide in March 2018; published article on abortion among adolescents in Ethiopia in March 2018; published Guttmacher-Lancet Commission report in May 2018; published article on complications from unsafe abortion in Kinshasa, DRC in September 2018; published article on abortion incidence among adolescents in Uganda in September 2018; published article on abortion incidence in Zimbabwe in October 2018; and published article on multi-country study of health systems&#x2019; capacity to provide post abortion care in November 2018. (2019) Published protocol for modeling and reporting unintended pregnancy and abortion estimates; article on novel approaches to estimating abortion incidence; article on trends in abortion methods and gestational age in high income countries; and article on disparities in health service coverage for reproductive health services. (2020) Published an article on abortion incidence and unintended pregnancy among adolescents in Zimbabwe; published Commentary with estimates of the potential impact of the COVID-19 pandemic on sexual and reproductive health in low- and middle-income countries in April 2020; published an article comparing different methods on measuring abortion incidence in Ghana in April 2020; published an article on estimating the incidence of abortion in Ghana in April 2020; published an article on a comparative study on abortion service provision in South Asia in May 2020; published an article on women&#x2019;s self-reported experiences using misoprostol obtained from drug sellers in Lagos State, Nigeria in May 2020; published article on budgeting for comprehensive sexual and reproductive health and rights under universal health coverage in June 2020; published article on health system cost of postabortion care in Senegal in June 2020; published article on mystery client methodology in Colombia misoprostol study in July 2020; published article on global unintended pregnancy and abortion estimates in July 2020; published article on the incidence of maternal near-miss in Kenya in September 2020; published article on classroom implementation of national sexuality education curricula in four LMICs in September 2020; published article on the prevalence and correlates of perceived infertility in Ghana in September 2020; published article on online abortion drug sales in Indonesia in October 2020; (2021) Published mixed methods study on sexual and reproductive health literacy, misoprostol knowledge and use of medication abortion in Lagos State, Nigeria in May 2021; published article on hormonal contraceptive use in Ghana in May 2021;published article on the use of fertility awareness-based methods for pregnancy prevention among Ghanaian women in June 2021; published article on  contraceptive and abortion practices of young Ghanaian women aged 15-24 in July 2021; published article on the health system costs of post abortion care in Tanzania in July 2021; published article on unintended pregnancy, induced abortion and abortion care-seeking experiences among adolescents in Kinshasa, Democratic Republic of Congo in September 2021; presentation on forthcoming scoping review on the impact of COVID-19 on the provision or and demand for SRH services was on December 6, 2021 at the International Population Conference (virtual).</narrative>
      </comment>
     </actual>
    </period>
   </indicator>
  </result>
  <result type="2">
   <title>
    <narrative xml:lang="EN">Capacity-building efforts are implemented with partners in each program country to improve skills in conducting SRH research and evidence-based communications.</narrative>
   </title>
   <indicator measure="1">
    <title>
     <narrative xml:lang="EN">Number of trainings conducted in project countries</narrative>
    </title>
    <description>
     <narrative xml:lang="EN">Guttmacher staff conduct trainings to build partners&apos; capacity in various dimensions of research and evidence-based communications.</narrative>
    </description>
    <baseline value="0" year="2016"></baseline>
    <period>
     <period-start iso-date="2017-01-01"></period-start>
     <period-end iso-date="2021-12-31"></period-end>
     <target value="13"></target>
     <actual value="24">
      <comment>
       <narrative xml:lang="EN">(2017) Completed analysis workshop for Zimbabwe abortion incidence study, a study design workshop with partners on misoprostol study, a communications capacity-building workshop with our research and communications partners in Zimbabwe and one with external partners at the International Population Conference in Cape Town, data collection training for fieldworkers in Colombia on the mystery client component of the misoprostol study, and data collection training for fieldworkers in Kenya. (2018) Held a second training for fieldworkers in Kenya; held four data collection trainings for fieldworkers in Ghana; held training for fieldworkers for costing study in Tanzania; held training for fieldworkers in Nigeria for the misoprostol study; held capacity building workshop for advocates in Uganda on communicating research findings effectively; conducted communications workshop in Kampala to build the capacity of advocates to effective utilize scientific evidence; hosted Colombia partners on misoprostol study for a one-week analysis workshop in New York; trained interviewers in data collection instrument for Tanzania costing study; hosted capacity building workshop in Kathmandu for research and communications partners from across Asia. (2019) Conducted a two-day communications workshop on strategic messaging, media outreach and presentation skills for our research and communications partners from Francophone countries in Sub-Saharan Africa; held half-day workshop for civil society partners in Ethiopia on effectively communicating research to policymakers and other stakeholders; hosted Nigeria partners on misoprostol study for one-week analysis and writing workshop in New York; trained staff from Planned Parenthood Association of Zambia on key elements of GLC report and in-country dissemination strategy; trained staff from ABAAD&#x2013;Resource Center for Gender Equality, based in Beirut, on key elements of GLC report and in-country dissemination strategy in Lebanon. (2021) In March, UMATI and Guttmacher hosted an in-person two-day workshop in Tanzania to train participants on advocacy skills, share the results of the health system costing study, and formulate the recommendations that would be included in the factsheet.</narrative>
      </comment>
     </actual>
    </period>
   </indicator>
   <indicator measure="1">
    <title>
     <narrative xml:lang="EN">Number of in-country communications partners</narrative>
    </title>
    <description>
     <narrative xml:lang="EN">In-country communications partners play a key role in designing and implementing communications strategies, with guidance from Guttmacher communications staff.</narrative>
    </description>
    <baseline value="0" year="2016"></baseline>
    <period>
     <period-start iso-date="2017-01-01"></period-start>
     <period-end iso-date="2021-12-31"></period-end>
     <target value="11"></target>
     <actual value="24">
      <comment>
